{
  "contentDigest": {
    "algorithm": "sha256",
    "canonicalization": "recursive-lexicographic-object-key-sort-arrays-preserve-order-json-utf8-lf-v1",
    "domain": "shieldkit-labs/p2/gate-b/cohort-executor-v3-snapshot-v1/authority-catalog/root",
    "frame": "utf8(domain)||0x00||canonical-json-utf8",
    "value": "0b1b796f31a8f7ef94ff3223c224c52ae89a677675df10929973c5c9012d28ef"
  },
  "corpusContentDigest": {
    "algorithm": "sha256",
    "canonicalization": "recursive-lexicographic-object-key-sort-arrays-preserve-order-json-utf8-lf-v1",
    "domain": "shieldkit-labs/p2/gate-b/canonical-corpus/v2/root",
    "frame": "utf8(domain)||0x00||canonical-json-utf8",
    "value": "9dad27b1fc8fd340212db1c216bff07e62f982736cfee95e1946919b0fc766db"
  },
  "counts": {
    "corpusCases": 1288,
    "eligiblePerEngine": 4608,
    "fixtures": 4732,
    "preflightFixtures": 124,
    "sourcePlans": 42,
    "workItems": 18928
  },
  "executionAllowed": false,
  "fixtureRosterContentDigest": {
    "algorithm": "sha256",
    "canonicalization": "recursive-lexicographic-object-key-sort-arrays-preserve-order-json-utf8-lf-v1",
    "domain": "shieldkit-labs/p2/gate-b/execution-epoch/v2/fixture-roster",
    "frame": "utf8(domain)||0x00||canonical-json-utf8",
    "value": "69ad6c072ebb6b2d19f4ec9b7665128b6270831cdd259efcc24daae27da3495d"
  },
  "frozen": [
    {
      "byteLength": 2885168,
      "contentDigest": {
        "algorithm": "sha256",
        "canonicalization": "recursive-lexicographic-object-key-sort-arrays-preserve-order-json-utf8-lf-v1",
        "domain": "shieldkit-labs/p2/gate-b/execution-epoch/v2/root",
        "frame": "utf8(domain)||0x00||canonical-json-utf8",
        "value": "6fcbaba3bb52d5e1eb9c6f1cb04b1d46cb65e2c91eba20ca38356dc323ebb11e"
      },
      "path": "research-lanes/bch-shielded-pool-design/p2/gate-b/cohort-freeze-v2/execution-epoch.v2.json",
      "rawSha256": "84ff8f6a85244b65d5d4f6e80c38b516223641ee444a133a67eb5794311d2dbc"
    },
    {
      "byteLength": 95098,
      "contentDigest": {
        "algorithm": "sha256",
        "canonicalization": "recursive-lexicographic-object-key-sort-arrays-preserve-order-json-utf8-lf-v1",
        "domain": "shieldkit-labs/p2/gate-b/campaign/v2/root",
        "frame": "utf8(domain)||0x00||canonical-json-utf8",
        "value": "194b48c079bb2ca3acc45959336809b3e4b20585d14716387eadc28b070cc372"
      },
      "path": "research-lanes/bch-shielded-pool-design/p2/gate-b/cohort-freeze-v2/campaign.v2.json",
      "rawSha256": "496498164f16ed1f42d73e74cd24ba0515bf670cf1e4ca5c3d467d4479667a7b"
    },
    {
      "byteLength": 2091144,
      "contentDigest": {
        "algorithm": "sha256",
        "canonicalization": "recursive-lexicographic-object-key-sort-arrays-preserve-order-json-utf8-lf-v1",
        "domain": "shieldkit-labs/p2/gate-b/canonical-corpus/v2/root",
        "frame": "utf8(domain)||0x00||canonical-json-utf8",
        "value": "9dad27b1fc8fd340212db1c216bff07e62f982736cfee95e1946919b0fc766db"
      },
      "path": "research-lanes/bch-shielded-pool-design/p2/gate-b/cohort-freeze-v2/canonical-corpus.v2.json",
      "rawSha256": "aa58ee1f520c14f7efae2046ca1fe8f82e352638511dac8cc506194dcc842158"
    },
    {
      "byteLength": 19405480,
      "contentDigest": {
        "algorithm": "sha256",
        "canonicalization": "recursive-lexicographic-object-key-sort-arrays-preserve-order-json-utf8-lf-v1",
        "domain": "shieldkit-labs/p2/gate-b/execution-epoch/v2/fixture-roster",
        "frame": "utf8(domain)||0x00||canonical-json-utf8",
        "value": "69ad6c072ebb6b2d19f4ec9b7665128b6270831cdd259efcc24daae27da3495d"
      },
      "path": "research-lanes/bch-shielded-pool-design/p2/gate-b/cohort-freeze-v2/fixture-roster.v2.json",
      "rawSha256": "cf62a64d7d0bbf73568ea36df23c2f463d4548ae407c41fd0bd0d62013e84e57"
    },
    {
      "byteLength": 20875668,
      "contentDigest": {
        "algorithm": "sha256",
        "canonicalization": "recursive-lexicographic-object-key-sort-arrays-preserve-order-json-utf8-lf-v1",
        "domain": "shieldkit-labs/p2/gate-b/execution-epoch/v2/work-item-roster",
        "frame": "utf8(domain)||0x00||canonical-json-utf8",
        "value": "c6f7e4ef13105b2c6b229f946df54fdf3c0f4f23e0834af164243f2c59ad41e2"
      },
      "path": "research-lanes/bch-shielded-pool-design/p2/gate-b/cohort-freeze-v2/work-item-roster.v2.json",
      "rawSha256": "cbbd0b03ce87189ebc056a341f5ef22b6f0cd1a7a052b0bd90865825404a37f9"
    }
  ],
  "metricsAllowed": false,
  "plans": [
    {
      "expectedOperandCount": 4,
      "hex": {
        "byteLength": 1635,
        "bytecodeBytes": 817,
        "bytecodeSha256": "ec66e3aecc8a971e7e5cf3ccef57fa740c663b189669939ef92fad4e02986435",
        "path": "research-lanes/bch-shielded-pool-design/p2/source-set-v1/plans/00-physical-plan-arm-canonical-m89-d2-canonical-schoolbook-v1-relation-e-mac-v1.hex",
        "rawSha256": "fadc63b3fcd7a7138217165ac5802826b550da078c18329fc127f7c2c55b9e65"
      },
      "map": {
        "byteLength": 591353,
        "contentDigest": {
          "algorithm": "sha256",
          "canonicalization": "recursive-lexicographic-object-key-sort-arrays-preserve-order-json-utf8-lf-v1",
          "domain": "shieldkit-labs/p2/source-set/v1/plan-map/physical-plan:arm:canonical:m89-d2-canonical-schoolbook-v1:relation:e-mac:v1",
          "frame": "utf8(domain)||0x00||canonical-json-utf8",
          "value": "742421ad9671275fbd213ecbe94b438bfef42f122b9f6a653850e0020e884243"
        },
        "path": "research-lanes/bch-shielded-pool-design/p2/source-set-v1/plans/00-physical-plan-arm-canonical-m89-d2-canonical-schoolbook-v1-relation-e-mac-v1.map.json",
        "rawSha256": "abe60d95ad8641d635bca6bcd8ef8a8f2830d9a9368001b7e0066a9f84e4cd95"
      },
      "orderIndex": 0,
      "planId": "physical-plan:arm:canonical:m89-d2-canonical-schoolbook-v1:relation:e-mac:v1"
    },
    {
      "expectedOperandCount": 3,
      "hex": {
        "byteLength": 1349,
        "bytecodeBytes": 674,
        "bytecodeSha256": "20ac0af567eb65d4d17984e30db048ad217d727ceab561f7d7a0432abe3b5e2d",
        "path": "research-lanes/bch-shielded-pool-design/p2/source-set-v1/plans/01-physical-plan-arm-canonical-m89-d2-canonical-schoolbook-v1-relation-e-square-mac-v1.hex",
        "rawSha256": "0578697b4c455c3250c91dd1ce6882bc898ac73e74692fd5f6b9bfd4394e166c"
      },
      "map": {
        "byteLength": 467958,
        "contentDigest": {
          "algorithm": "sha256",
          "canonicalization": "recursive-lexicographic-object-key-sort-arrays-preserve-order-json-utf8-lf-v1",
          "domain": "shieldkit-labs/p2/source-set/v1/plan-map/physical-plan:arm:canonical:m89-d2-canonical-schoolbook-v1:relation:e-square-mac:v1",
          "frame": "utf8(domain)||0x00||canonical-json-utf8",
          "value": "c1bfdaab5accfccd818fa37b2c6dd5790cb6e922af10fc8518ef2e27c97f4e63"
        },
        "path": "research-lanes/bch-shielded-pool-design/p2/source-set-v1/plans/01-physical-plan-arm-canonical-m89-d2-canonical-schoolbook-v1-relation-e-square-mac-v1.map.json",
        "rawSha256": "abc76f2b18dccfe9e2e0057c68180a183b5dcba2759cdb0897853566192c5ece"
      },
      "orderIndex": 1,
      "planId": "physical-plan:arm:canonical:m89-d2-canonical-schoolbook-v1:relation:e-square-mac:v1"
    },
    {
      "expectedOperandCount": 2,
      "hex": {
        "byteLength": 1105,
        "bytecodeBytes": 552,
        "bytecodeSha256": "3ce495ceba0805dfa7d0b10bd6ff2faa9789b845fb166f94c2f0887c43f7a9ac",
        "path": "research-lanes/bch-shielded-pool-design/p2/source-set-v1/plans/02-physical-plan-arm-canonical-m89-d2-canonical-schoolbook-v1-relation-e-inverse-check-v1.hex",
        "rawSha256": "a4ca66312ea057b8c436c6b305322d1d3a727c25d79a72b5c7bece6c5ec1c068"
      },
      "map": {
        "byteLength": 383675,
        "contentDigest": {
          "algorithm": "sha256",
          "canonicalization": "recursive-lexicographic-object-key-sort-arrays-preserve-order-json-utf8-lf-v1",
          "domain": "shieldkit-labs/p2/source-set/v1/plan-map/physical-plan:arm:canonical:m89-d2-canonical-schoolbook-v1:relation:e-inverse-check:v1",
          "frame": "utf8(domain)||0x00||canonical-json-utf8",
          "value": "6244e5651cf01ae625a5430e662876eaa108214a13377bc5b51fbd8a71aa32f2"
        },
        "path": "research-lanes/bch-shielded-pool-design/p2/source-set-v1/plans/02-physical-plan-arm-canonical-m89-d2-canonical-schoolbook-v1-relation-e-inverse-check-v1.map.json",
        "rawSha256": "7618e4892c640dbab0abb1bd390a4677789c12cba59be962ea124e3e54742715"
      },
      "orderIndex": 2,
      "planId": "physical-plan:arm:canonical:m89-d2-canonical-schoolbook-v1:relation:e-inverse-check:v1"
    },
    {
      "expectedOperandCount": 4,
      "hex": {
        "byteLength": 2439,
        "bytecodeBytes": 1219,
        "bytecodeSha256": "ceba70f5ce88c8be5516d23e3385f122d9070b27f9734effa4adad930b3616af",
        "path": "research-lanes/bch-shielded-pool-design/p2/source-set-v1/plans/03-physical-plan-arm-canonical-m61-d3-canonical-schoolbook-v1-relation-e-mac-v1.hex",
        "rawSha256": "23d9d56013635c4cd624269f0a8c77359b11d856bece042cb8b609f1c1e52542"
      },
      "map": {
        "byteLength": 998132,
        "contentDigest": {
          "algorithm": "sha256",
          "canonicalization": "recursive-lexicographic-object-key-sort-arrays-preserve-order-json-utf8-lf-v1",
          "domain": "shieldkit-labs/p2/source-set/v1/plan-map/physical-plan:arm:canonical:m61-d3-canonical-schoolbook-v1:relation:e-mac:v1",
          "frame": "utf8(domain)||0x00||canonical-json-utf8",
          "value": "778f65cd3370102165781f7234278a613c88cac714f1d6b4dfb6c9bddd9626f5"
        },
        "path": "research-lanes/bch-shielded-pool-design/p2/source-set-v1/plans/03-physical-plan-arm-canonical-m61-d3-canonical-schoolbook-v1-relation-e-mac-v1.map.json",
        "rawSha256": "6fd493f748796ad5801a3dcbf3cf2c0a70b53717e3809dbcb33fca704c10738d"
      },